code,title,description,technical note
registeredEntity,Registered Entity,"Any legal entity created through an act of official registration. In most cases, registered entities will have an official issued identifier.",
legalEntity,Legal entity,"An organisation, such as a company or partnership, that has its own legal personality, responsibilities, and rights; for example, the right to enter into contracts.",
arrangement,Arrangement,"An artificial entity, created by agreements, contracts or other processes.",
anonymousEntity,Anonymous entity,"An entity that has been identified, but for which no identifying information is being published.",
unknownEntity,Unknown entity,An entity that has not been identified.,
state,State,"A country, nation or community with legal sovereignty within a territory.",
stateBody,State body,A core administrative or legislative unit within a state's apparatus.,
